{
  "session_id": "20260506_fil_volcap_test_001",
  "created_at": "2026-05-06T00:00:00+00:00",
  "operator": "unset",
  "node_count": 1,
  "camera_count": 1,
  "calibration_id": "calib_pending",
  "lighting_profile": "studio_pending",
  "sync_mode": "external_fsync",
  "capture": {
    "fps": 30,
    "width": 1920,
    "height": 1200,
    "pixel_format": "RAW10",
    "master_format": "rawpack",
    "preview_format": "h264_low_res"
  },
  "nodes": [
    {
      "node_id": "node_001",
      "hostname": "jetson-node-001",
      "cameras": [
        {
          "camera_id": "cam_001",
          "port_id": 1,
          "serial": "TBD",
          "lens_id": "lens_001",
          "exposure_us": 5000,
          "gain": 1.0
        }
      ]
    }
  ]
}
